06/11/19,PavingAndPotholes,Data Release: Paving and Potholes,https://controller.phila.gov/philadelphia-audits/data-release-paving-and-potholes/
01/23/20,MappingStructuralRacism,Mapping the Legacy of Structural Racism in Philadelphia,https://controller.phila.gov/philadelphia-audits/mapping-the-legacy-of-structural-racism-in-philadelphia/
01/23/20,AntiViolenceSpending,Data Release: FY20 Violence Reduction Spending,https://controller.phila.gov/philadelphia-audits/data-release-fy20-violence-reduction-spending/
04/27/20,FiscalImpactCOVID19,Estimates of the Impact of COVID-19 on the City of Philadelphia’s Tax Revenues,https://controller.phila.gov/philadelphia-audits/covid19-fiscal-impact/
7/24/20,FY21BudgetViz,Visualizing the Adopted FY21 Budget,https://controller.phila.gov/philadelphia-audits/interactive-fy21-budget/
09/15/20,GunViolenceDashboard,Mapping Philadelphia's Gun Violence Crisis,https://controller.phila.gov/philadelphia-audits/mapping-gun-violence